{
  "blockers": [],
  "content_fingerprint": "sha256:0000000000000000000000000000000000000000000000000000000000000000",
  "dependency_edges": [],
  "handoff_id": "fixture",
  "participants": [],
  "ready_for_change_bundle": false,
  "schema_id": "star.cross-project-migration-handoff",
  "schema_version": 1
}